{
  "schema_version": "simulation-profile.v1",
  "profile_id": "ai_memory_badge_v1-profile",
  "project_id": "ai-memory-badge-v1",
  "project_name": "ai_memory_badge_v1",
  "topology": "ai_memory_badge_v1",
  "default_backend": "ngspice",
  "preferred_analyses": [
    "op",
    "tran"
  ],
  "tags": [
    "auto",
    "from-circuit-model"
  ],
  "thresholds": {
    "vout_min_v": 0.0,
    "vout_max_v": 0.0,
    "ripple_max_mv": 0.0,
    "startup_overshoot_percent": 0.0,
    "startup_settle_ms": 0.0
  },
  "notes": []
}
